{
  "task_id": "T-RUNTIME-LOW-001",
  "title": "valid runtime low",
  "density": "low",
  "stage": "executing",
  "status": "active",
  "goal": "将响应字段从 token 改为 access_token",
  "first_executor": "executor-a",
  "current_owner": "executor-a",
  "next_action": "修改响应字段并更新测试",
  "last_event": "TRIAGE_DONE",
  "verification_level": "optional",
  "repair_direction": null,
  "triage_result": {
    "decision_path": "Q3",
    "density": "low",
    "rationale": "目标明确、单文件改动、无设计分歧"
  },
  "artifacts": {
    "triage": "artifacts/T-RUNTIME-LOW-001/triage.md",
    "scope": null,
    "design": null,
    "plan": null,
    "execution": null,
    "verification": null,
    "review": null,
    "handoff": null,
    "task_packet": null
  },
  "todo": [
    {
      "id": "t1",
      "text": "修改响应字段并更新测试",
      "status": "in_progress"
    }
  ]
}
